[
 {"id":0,"m":{"x":"a"},"open":{"p":1},"cnt":{"a":1},"lst":[{"u":1},{"v":2}],"cond":{"kind":"A","note":null}},
 {"id":1,"m":{"y":"b"},"open":{"q":2},"cnt":{"b":2},"lst":[{"u":3}],"cond":{"kind":"B"}},
 {"id":2,"m":{"x":"c","y":"d"},"open":{"p":3,"q":4},"cnt":{"a":1,"b":2},"lst":[],"cond":{"kind":"A","note":"n"}}
]
